{
  "case_id": "UAC-001",
  "split": "dev",
  "mordor_log": "datasets/compound/apt29/day1/apt29_evals_day1_manual.zip",
  "computer": "SCRANTON",
  "sourcetypes_present": [
    "XmlWinEventLog:Microsoft-Windows-Sysmon/Operational"
  ],
  "selection": {
    "A0": "348988",
    "EV": [
      "348643",
      "348647",
      "349079",
      "349211",
      "350757"
    ]
  },
  "roles": {
    "348988": "triggering alert: medium-integrity explorer launches sdclt.exe, which starts at high integrity",
    "348643": "the per-user Folder shell open handler is set to a PowerShell command",
    "348647": "DelegateExecute is set to an empty value for the hijacked handler",
    "349079": "high-integrity sdclt.exe starts high-integrity control.exe for BackupAndRestoreCenter",
    "349211": "high-integrity control.exe starts the configured PowerShell payload at high integrity",
    "350757": "the per-user Folder shell open command key is deleted after execution"
  },
  "derivations": [],
  "metadata": {
    "case_name": "sdclt.exe auto-elevation UAC bypass via Folder shell open command hijack",
    "security_proposition": "The per-user Folder handler hijack caused a PowerShell payload to execute at high integrity through sdclt.exe and control.exe.",
    "case_directory": "UAC-001_sdclt_uac_bypass",
    "status": "audited_dev_2026-07-16",
    "dataset": "OTRF Security-Datasets (mordor)",
    "created_date": "2026-07-06",
    "attack_category": {
      "category": "sdclt-based UAC bypass",
      "candidate_attack_mapping": "T1548.002",
      "model_visible": false,
      "note": "RESEARCHER-INTENT: evidence_condition = STRONG. The registry hijack and sdclt process chain establish the bypass mechanism and elevated execution. Do not leak to model."
    },
    "tier": {
      "tier": 1,
      "sensors": [
        "sysmon"
      ]
    },
    "case_scope": {
      "primary_host": "SCRANTON.dmevals.local",
      "boundary_definition": [
        "The case follows one registry-hijack lifecycle from handler creation through elevated payload execution and cleanup.",
        "The later key deletion is retained as mitigating cleanup evidence; it does not undo the observed high-integrity execution."
      ]
    },
    "curation_notes": [
      "Subtle-strong (up-rank): the surface is two Microsoft system binaries running (sdclt.exe -> control.exe /name Microsoft.BackupAndRestoreCenter), which reads as benign backup / control-panel activity and invites under-triage. The package does not perform signature verification.",
      "Confirmed malice sits in the EVs: HKCU Classes\\Folder\\shell\\open\\command\\(Default) is hijacked to PowerShell and DelegateExecute emptied, sdclt auto-elevates (Medium->High), and control.exe starts that PowerShell payload at High integrity. The key is later deleted. Confirmed UAC bypass; correct verdict malicious/high."
    ],
    "experimental_role": {
      "used_for": [
        "subtle_strong_exemplar",
        "cross_corpus_generalisation",
        "severity_preservation_test"
      ],
      "eligible_for_final_heldout_metrics": false
    },
    "review_status": "reviewed_for_benchmark_v1.1",
    "review_required": {
      "ground_truth": "Ground truth reviewed and frozen under benchmark rubric v1.1."
    }
  }
}
